{
  "capabilities": {
    "KYGEC": {
      "cruise_arrival_screening": false,
      "departure_health_cert": false,
      "genotyping_available": false,
      "lab_confirmation": false,
      "lab_turnaround_days": 2.0,
      "population": 35000,
      "port_id": "KYGEC",
      "port_name": "George Town",
      "region": "AMR",
      "reporting_threshold": null,
      "reports_to": "CARPHA",
      "syndromic_coverage": 0.3,
      "syndromic_delay_days": 5,
      "syndromic_enabled": true,
      "wbe_assay": null,
      "wbe_enabled": false,
      "wbe_frequency_days": 7.0,
      "wbe_lod_gc_per_l": 100.0
    },
    "MXCZM": {
      "cruise_arrival_screening": false,
      "departure_health_cert": false,
      "genotyping_available": false,
      "lab_confirmation": false,
      "lab_turnaround_days": 2.0,
      "population": 100000,
      "port_id": "MXCZM",
      "port_name": "Cozumel",
      "region": "AMR",
      "reporting_threshold": null,
      "reports_to": "local_only",
      "syndromic_coverage": 0.2,
      "syndromic_delay_days": 7,
      "syndromic_enabled": true,
      "wbe_assay": null,
      "wbe_enabled": false,
      "wbe_frequency_days": 7.0,
      "wbe_lod_gc_per_l": 100.0
    },
    "USMIA": {
      "cruise_arrival_screening": true,
      "departure_health_cert": false,
      "genotyping_available": true,
      "lab_confirmation": true,
      "lab_turnaround_days": 1.0,
      "population": 450000,
      "port_id": "USMIA",
      "port_name": "Miami",
      "region": "AMR",
      "reporting_threshold": "3% AGE",
      "reports_to": "CDC_VSP",
      "syndromic_coverage": 0.6,
      "syndromic_delay_days": 3,
      "syndromic_enabled": true,
      "wbe_assay": "qpcr",
      "wbe_enabled": true,
      "wbe_frequency_days": 2.0,
      "wbe_lod_gc_per_l": 100.0
    }
  },
  "n_days": 7,
  "observations": [
    {
      "alert_level": "normal",
      "day_index": 0,
      "genotype": null,
      "genotyping_capable": false,
      "lab_capable": false,
      "lab_confirmed_cases": 0,
      "lab_result_date": null,
      "observation_date": "",
      "pathogen": "norovirus",
      "port_id": "KYGEC",
      "reporting_threshold": null,
      "reports_to": "CARPHA",
      "syndromic_capable": true,
      "syndromic_cases_reported": 0,
      "syndromic_rate_per_100k": 0.0,
      "syndromic_report_date": null,
      "true_community_prevalence": 0.0,
      "true_incidence_per_100k_day": 0.0,
      "true_ww_gc_per_l": 0.0,
      "wbe_capable": false,
      "wbe_detected": false,
      "wbe_gc_per_l_observed": 0.00029425950120494626,
      "wbe_sampled": true
    },
    {
      "alert_level": "normal",
      "day_index": 1,
      "genotype": null,
      "genotyping_capable": false,
      "lab_capable": false,
      "lab_confirmed_cases": 0,
      "lab_result_date": null,
      "observation_date": "",
      "pathogen": "norovirus",
      "port_id": "KYGEC",
      "reporting_threshold": null,
      "reports_to": "CARPHA",
      "syndromic_capable": true,
      "syndromic_cases_reported": 0,
      "syndromic_rate_per_100k": 0.0,
      "syndromic_report_date": null,
      "true_community_prevalence": 0.0,
      "true_incidence_per_100k_day": 0.0,
      "true_ww_gc_per_l": 0.0,
      "wbe_capable": false,
      "wbe_detected": false,
      "wbe_gc_per_l_observed": 0.0008477852788742981,
      "wbe_sampled": false
    },
    {
      "alert_level": "normal",
      "day_index": 2,
      "genotype": null,
      "genotyping_capable": false,
      "lab_capable": false,
      "lab_confirmed_cases": 0,
      "lab_result_date": null,
      "observation_date": "",
      "pathogen": "norovirus",
      "port_id": "KYGEC",
      "reporting_threshold": null,
      "reports_to": "CARPHA",
      "syndromic_capable": true,
      "syndromic_cases_reported": 0,
      "syndromic_rate_per_100k": 0.0,
      "syndromic_report_date": null,
      "true_community_prevalence": 0.0,
      "true_incidence_per_100k_day": 0.0,
      "true_ww_gc_per_l": 0.0,
      "wbe_capable": false,
      "wbe_detected": false,
      "wbe_gc_per_l_observed": 0.0014770757872894784,
      "wbe_sampled": false
    },
    {
      "alert_level": "normal",
      "day_index": 3,
      "genotype": null,
      "genotyping_capable": false,
      "lab_capable": false,
      "lab_confirmed_cases": 0,
      "lab_result_date": null,
      "observation_date": "",
      "pathogen": "norovirus",
      "port_id": "KYGEC",
      "reporting_threshold": null,
      "reports_to": "CARPHA",
      "syndromic_capable": true,
      "syndromic_cases_reported": 0,
      "syndromic_rate_per_100k": 0.0,
      "syndromic_report_date": null,
      "true_community_prevalence": 0.0,
      "true_incidence_per_100k_day": 0.0,
      "true_ww_gc_per_l": 0.0,
      "wbe_capable": false,
      "wbe_detected": false,
      "wbe_gc_per_l_observed": 0.0007314942305570433,
      "wbe_sampled": false
    },
    {
      "alert_level": "normal",
      "day_index": 4,
      "genotype": null,
      "genotyping_capable": false,
      "lab_capable": false,
      "lab_confirmed_cases": 0,
      "lab_result_date": null,
      "observation_date": "",
      "pathogen": "norovirus",
      "port_id": "KYGEC",
      "reporting_threshold": null,
      "reports_to": "CARPHA",
      "syndromic_capable": true,
      "syndromic_cases_reported": 0,
      "syndromic_rate_per_100k": 0.0,
      "syndromic_report_date": null,
      "true_community_prevalence": 0.0,
      "true_incidence_per_100k_day": 0.0,
      "true_ww_gc_per_l": 0.0,
      "wbe_capable": false,
      "wbe_detected": false,
      "wbe_gc_per_l_observed": 0.0005206813773195515,
      "wbe_sampled": false
    },
    {
      "alert_level": "normal",
      "day_index": 5,
      "genotype": null,
      "genotyping_capable": false,
      "lab_capable": false,
      "lab_confirmed_cases": 0,
      "lab_result_date": null,
      "observation_date": "",
      "pathogen": "norovirus",
      "port_id": "KYGEC",
      "reporting_threshold": null,
      "reports_to": "CARPHA",
      "syndromic_capable": true,
      "syndromic_cases_reported": 0,
      "syndromic_rate_per_100k": 0.0,
      "syndromic_report_date": null,
      "true_community_prevalence": 0.0,
      "true_incidence_per_100k_day": 0.0,
      "true_ww_gc_per_l": 0.0,
      "wbe_capable": false,
      "wbe_detected": false,
      "wbe_gc_per_l_observed": 0.0004326022261133357,
      "wbe_sampled": false
    },
    {
      "alert_level": "normal",
      "day_index": 6,
      "genotype": null,
      "genotyping_capable": false,
      "lab_capable": false,
      "lab_confirmed_cases": 0,
      "lab_result_date": null,
      "observation_date": "",
      "pathogen": "norovirus",
      "port_id": "KYGEC",
      "reporting_threshold": null,
      "reports_to": "CARPHA",
      "syndromic_capable": true,
      "syndromic_cases_reported": 0,
      "syndromic_rate_per_100k": 0.0,
      "syndromic_report_date": null,
      "true_community_prevalence": 0.0,
      "true_incidence_per_100k_day": 0.0,
      "true_ww_gc_per_l": 0.0,
      "wbe_capable": false,
      "wbe_detected": false,
      "wbe_gc_per_l_observed": 0.00043803776473152556,
      "wbe_sampled": false
    },
    {
      "alert_level": "elevated",
      "day_index": 0,
      "genotype": null,
      "genotyping_capable": false,
      "lab_capable": false,
      "lab_confirmed_cases": 56,
      "lab_result_date": null,
      "observation_date": "",
      "pathogen": "norovirus",
      "port_id": "MXCZM",
      "reporting_threshold": null,
      "reports_to": "local_only",
      "syndromic_capable": true,
      "syndromic_cases_reported": 105,
      "syndromic_rate_per_100k": 105.0,
      "syndromic_report_date": null,
      "true_community_prevalence": 0.01,
      "true_incidence_per_100k_day": 500.0,
      "true_ww_gc_per_l": 500000.0,
      "wbe_capable": false,
      "wbe_detected": true,
      "wbe_gc_per_l_observed": 698793.8031288803,
      "wbe_sampled": true
    },
    {
      "alert_level": "elevated",
      "day_index": 1,
      "genotype": null,
      "genotyping_capable": false,
      "lab_capable": false,
      "lab_confirmed_cases": 61,
      "lab_result_date": null,
      "observation_date": "",
      "pathogen": "norovirus",
      "port_id": "MXCZM",
      "reporting_threshold": null,
      "reports_to": "local_only",
      "syndromic_capable": true,
      "syndromic_cases_reported": 107,
      "syndromic_rate_per_100k": 107.0,
      "syndromic_report_date": null,
      "true_community_prevalence": 0.01,
      "true_incidence_per_100k_day": 500.0,
      "true_ww_gc_per_l": 500000.0,
      "wbe_capable": false,
      "wbe_detected": true,
      "wbe_gc_per_l_observed": 1676906.781916442,
      "wbe_sampled": false
    },
    {
      "alert_level": "elevated",
      "day_index": 2,
      "genotype": null,
      "genotyping_capable": false,
      "lab_capable": false,
      "lab_confirmed_cases": 49,
      "lab_result_date": null,
      "observation_date": "",
      "pathogen": "norovirus",
      "port_id": "MXCZM",
      "reporting_threshold": null,
      "reports_to": "local_only",
      "syndromic_capable": true,
      "syndromic_cases_reported": 87,
      "syndromic_rate_per_100k": 87.0,
      "syndromic_report_date": null,
      "true_community_prevalence": 0.01,
      "true_incidence_per_100k_day": 500.0,
      "true_ww_gc_per_l": 500000.0,
      "wbe_capable": false,
      "wbe_detected": true,
      "wbe_gc_per_l_observed": 3495918.7833460793,
      "wbe_sampled": false
    },
    {
      "alert_level": "elevated",
      "day_index": 3,
      "genotype": null,
      "genotyping_capable": false,
      "lab_capable": false,
      "lab_confirmed_cases": 42,
      "lab_result_date": null,
      "observation_date": "",
      "pathogen": "norovirus",
      "port_id": "MXCZM",
      "reporting_threshold": null,
      "reports_to": "local_only",
      "syndromic_capable": true,
      "syndromic_cases_reported": 92,